outputs/proj1_final_20260502_201946/properties.json

{
  "schema_version": "1.0",
  "render": {
    "name": "proj1_final",
    "width": 800,
    "height": 600,
    "samples_per_pixel": 1,
    "sampling_mode": "jittered",
    "seed": null,
    "gamma_fix": false,
    "render_time_seconds": 144.18893529099296,
    "ray_estimation": {
      "primary_rays": 480000,
      "secondary_rays": 66199,
      "shadow_rays": 1196688,
      "total_rays": 1742887,
      "estimated_time_seconds": 63.55483403533941,
      "estimated_time_minutes": 1.0592472339223236,
      "formatted_time": "63.555s (1.059 min)",
      "throughput_rays_per_second": 27423,
      "primary_hit_ratio": 0.1825782092772384,
      "recursive_surface_ratio": 0.5384615384615384,
      "shadow_samples_per_hit": 12,
      "estimated_intersection_tests": 22657531,
      "measured_intersection_throughput": 356503.660876549,
      "estimated_time_by_intersections_seconds": 63.55483403533942,
      "estimated_time_by_intersections_minutes": 1.0592472339223236,
      "avg_intersections_per_ray": 13.0,
      "calibration": {
        "calibration_elapsed_seconds": 0.07190949999494478,
        "calibration_samples_tested": 256,
        "calibration_rays_traced": 618,
        "calibration_intersection_tests": 25636,
        "calibration_shadow_rays": 1354,
        "measured_throughput_rays_per_second": 27423.358528965313
      }
    },
    "estimation_quality": {
      "rays_model_estimated_seconds": 63.55483403533941,
      "rays_model_actual_seconds": 144.18893529099296,
      "rays_model_absolute_error_seconds": 80.63410125565355,
      "rays_model_relative_error": 0.5592253045833435,
      "rays_model_accuracy_percent": 44.07746954166565,
      "rays_model_actual_over_estimated": 2.268732779804244,
      "intersection_model_estimated_seconds": 63.55483403533942,
      "intersection_model_actual_seconds": 144.18893529099296,
      "intersection_model_absolute_error_seconds": 80.63410125565355,
      "intersection_model_relative_error": 0.5592253045833435,
      "intersection_model_accuracy_percent": 44.07746954166565,
      "intersection_model_actual_over_estimated": 2.268732779804244
    }
  },
  "scene": {
    "ambient_light": [
      0.019999999552965164,
      0.019999999552965164,
      0.019999999552965164
    ],
    "background_color": [
      0.019999999552965164,
      0.019999999552965164,
      0.05000000074505806
    ],
    "max_depth": 8,
    "ray_epsilon": 0.001
  },
  "camera": {
    "eye": [
      2.7750000953674316,
      3.200000047683716,
      12.774999618530273
    ],
    "center": [
      2.7750000953674316,
      2.7750000953674316,
      2.7750000953674316
    ],
    "up": [
      0.0,
      1.0,
      0.0
    ],
    "fov": 50.0,
    "focal_distance": 1.0,
    "aspect": 1.3333333333333333
  },
  "objects": [
    {
      "type": "Box",
      "material": {
        "type": "ReflectiveMaterial",
        "ambient": [
          0.05000000074505806,
          0.05000000074505806,
          0.05000000074505806
        ],
        "diffuse": [
          0.30000001192092896,
          0.30000001192092896,
          0.30000001192092896
        ],
        "specular": [
          0.3499999940395355,
          0.3499999940395355,
          0.3499999940395355
        ],
        "shininess": 96.0,
        "reflectivity": [
          0.699999988079071,
          0.699999988079071,
          0.699999988079071
        ]
      },
      "shape_chain": [
        "Box"
      ],
      "p_min": [
        -0.10000000149011612,
        -0.10000000149011612,
        -0.10000000149011612
      ],
      "p_max": [
        5.650000095367432,
        5.650000095367432,
        0.0
      ]
    },
    {
      "type": "Box",
      "material": {
        "type": "PhongMaterial",
        "ambient": [
          0.029999999329447746,
          0.05000000074505806,
          0.029999999329447746
        ],
        "diffuse": [
          0.11999999731779099,
          0.7200000286102295,
          0.15000000596046448
        ],
        "specular": [
          0.029999999329447746,
          0.029999999329447746,
          0.029999999329447746
        ],
        "shininess": 6.0
      },
      "shape_chain": [
        "Box"
      ],
      "p_min": [
        -0.10000000149011612,
        -0.10000000149011612,
        0.0
      ],
      "p_max": [
        0.0,
        5.550000190734863,
        5.550000190734863
      ]
    },
    {
      "type": "Box",
      "material": {
        "type": "PhongMaterial",
        "ambient": [
          0.05000000074505806,
          0.019999999552965164,
          0.019999999552965164
        ],
        "diffuse": [
          0.550000011920929,
          0.11999999731779099,
          0.11999999731779099
        ],
        "specular": [
          0.949999988079071,
          0.949999988079071,
          0.949999988079071
        ],
        "shininess": 180.0
      },
      "shape_chain": [
        "Box"
      ],
      "p_min": [
        5.550000190734863,
        -0.10000000149011612,
        0.0
      ],
      "p_max": [
        5.650000095367432,
        5.550000190734863,
        5.550000190734863
      ]
    },
    {
      "type": "Box",
      "material": {
        "type": "ReflectiveMaterial",
        "ambient": [
          0.05000000074505806,
          0.05000000074505806,
          0.05000000074505806
        ],
        "diffuse": [
          0.30000001192092896,
          0.30000001192092896,
          0.30000001192092896
        ],
        "specular": [
          0.3499999940395355,
          0.3499999940395355,
          0.3499999940395355
        ],
        "shininess": 96.0,
        "reflectivity": [
          0.699999988079071,
          0.699999988079071,
          0.699999988079071
        ]
      },
      "shape_chain": [
        "Box"
      ],
      "p_min": [
        0.0,
        5.550000190734863,
        0.0
      ],
      "p_max": [
        5.550000190734863,
        5.650000095367432,
        5.550000190734863
      ]
    },
    {
      "type": "Box",
      "material": {
        "type": "PhongMaterial",
        "ambient": [
          0.029999999329447746,
          0.029999999329447746,
          0.029999999329447746
        ],
        "diffuse": [
          0.6800000071525574,
          0.6800000071525574,
          0.6800000071525574
        ],
        "specular": [
          0.07999999821186066,
          0.07999999821186066,
          0.07999999821186066
        ],
        "shininess": 18.0
      },
      "shape_chain": [
        "Box"
      ],
      "p_min": [
        -0.10000000149011612,
        -0.10000000149011612,
        0.0
      ],
      "p_max": [
        5.650000095367432,
        0.0,
        5.550000190734863
      ]
    },
    {
      "type": "Translate",
      "material": {
        "type": "TransparentMaterial",
        "ambient": [
          0.0,
          0.0,
          0.0
        ],
        "diffuse": [
          0.0,
          0.0,
          0.0
        ],
        "specular": [
          0.0,
          0.0,
          0.0
        ],
        "shininess": 1.0,
        "attenuation": [
          0.8600000143051147,
          0.9200000166893005,
          0.9800000190734863
        ],
        "ior": 1.5
      },
      "shape": {
        "type": "Rotate",
        "material": {
          "type": "TransparentMaterial",
          "ambient": [
            0.0,
            0.0,
            0.0
          ],
          "diffuse": [
            0.0,
            0.0,
            0.0
          ],
          "specular": [
            0.0,
            0.0,
            0.0
          ],
          "shininess": 1.0,
          "attenuation": [
            0.8600000143051147,
            0.9200000166893005,
            0.9800000190734863
          ],
          "ior": 1.5
        },
        "shape": {
          "type": "Box",
          "material": {
            "type": "TransparentMaterial",
            "ambient": [
              0.0,
              0.0,
              0.0
            ],
            "diffuse": [
              0.0,
              0.0,
              0.0
            ],
            "specular": [
              0.0,
              0.0,
              0.0
            ],
            "shininess": 1.0,
            "attenuation": [
              0.8600000143051147,
              0.9200000166893005,
              0.9800000190734863
            ],
            "ior": 1.5
          },
          "shape_chain": [
            "Box"
          ],
          "p_min": [
            0.0,
            0.0,
            0.0
          ],
          "p_max": [
            1.649999976158142,
            1.649999976158142,
            0.30000001192092896
          ]
        },
        "shape_chain": [
          "Rotate",
          "Box"
        ],
        "matrix": [
          [
            0.9510565400123596,
            0.0,
            -0.30901700258255005,
            0.0
          ],
          [
            0.0,
            1.0,
            0.0,
            0.0
          ],
          [
            0.30901700258255005,
            0.0,
            0.9510565400123596,
            0.0
          ],
          [
            0.0,
            0.0,
            0.0,
            1.0
          ]
        ]
      },
      "shape_chain": [
        "Translate",
        "Rotate",
        "Box"
      ],
      "matrix": [
        [
          1.0,
          0.0,
          0.0,
          3.4000000953674316
        ],
        [
          0.0,
          1.0,
          0.0,
          1.2000000476837158
        ],
        [
          0.0,
          0.0,
          1.0,
          5.650000095367432
        ],
        [
          0.0,
          0.0,
          0.0,
          1.0
        ]
      ]
    },
    {
      "type": "Translate",
      "material": {
        "type": "ReflectiveMaterial",
        "ambient": [
          0.03999999910593033,
          0.03999999910593033,
          0.03999999910593033
        ],
        "diffuse": [
          0.25,
          0.25,
          0.25
        ],
        "specular": [
          0.25,
          0.25,
          0.25
        ],
        "shininess": 80.0,
        "reflectivity": [
          0.7200000286102295,
          0.7200000286102295,
          0.7200000286102295
        ]
      },
      "shape": {
        "type": "Rotate",
        "material": {
          "type": "ReflectiveMaterial",
          "ambient": [
            0.03999999910593033,
            0.03999999910593033,
            0.03999999910593033
          ],
          "diffuse": [
            0.25,
            0.25,
            0.25
          ],
          "specular": [
            0.25,
            0.25,
            0.25
          ],
          "shininess": 80.0,
          "reflectivity": [
            0.7200000286102295,
            0.7200000286102295,
            0.7200000286102295
          ]
        },
        "shape": {
          "type": "Box",
          "material": {
            "type": "ReflectiveMaterial",
            "ambient": [
              0.03999999910593033,
              0.03999999910593033,
              0.03999999910593033
            ],
            "diffuse": [
              0.25,
              0.25,
              0.25
            ],
            "specular": [
              0.25,
              0.25,
              0.25
            ],
            "shininess": 80.0,
            "reflectivity": [
              0.7200000286102295,
              0.7200000286102295,
              0.7200000286102295
            ]
          },
          "shape_chain": [
            "Box"
          ],
          "p_min": [
            0.0,
            0.0,
            0.0
          ],
          "p_max": [
            1.649999976158142,
            3.299999952316284,
            1.649999976158142
          ]
        },
        "shape_chain": [
          "Rotate",
          "Box"
        ],
        "matrix": [
          [
            0.9238795042037964,
            0.0,
            0.3826834559440613,
            0.0
          ],
          [
            0.0,
            1.0,
            0.0,
            0.0
          ],
          [
            -0.3826834559440613,
            0.0,
            0.9238795042037964,
            0.0
          ],
          [
            0.0,
            0.0,
            0.0,
            1.0
          ]
        ]
      },
      "shape_chain": [
        "Translate",
        "Rotate",
        "Box"
      ],
      "matrix": [
        [
          1.0,
          0.0,
          0.0,
          0.6499999761581421
        ],
        [
          0.0,
          1.0,
          0.0,
          0.0
        ],
        [
          0.0,
          0.0,
          1.0,
          1.2999999523162842
        ],
        [
          0.0,
          0.0,
          0.0,
          1.0
        ]
      ]
    },
    {
      "type": "TriangleMesh",
      "material": {
        "type": "ReflectiveMaterial",
        "ambient": [
          0.029999999329447746,
          0.029999999329447746,
          0.029999999329447746
        ],
        "diffuse": [
          0.18000000715255737,
          0.18000000715255737,
          0.18000000715255737
        ],
        "specular": [
          0.30000001192092896,
          0.30000001192092896,
          0.30000001192092896
        ],
        "shininess": 120.0,
        "reflectivity": [
          0.800000011920929,
          0.800000011920929,
          0.800000011920929
        ]
      },
      "shape_chain": [
        "TriangleMesh"
      ],
      "vertices": [
        [
          1.9000000953674316,
          1.0499999523162842,
          4.25
        ],
        [
          2.450000047683716,
          1.0499999523162842,
          4.800000190734863
        ],
        [
          3.0,
          1.0499999523162842,
          4.25
        ],
        [
          2.450000047683716,
          1.0499999523162842,
          3.700000047683716
        ],
        [
          2.450000047683716,
          2.0,
          4.25
        ]
      ],
      "faces": [
        [
          0,
          1,
          4
        ],
        [
          1,
          2,
          4
        ],
        [
          2,
          3,
          4
        ],
        [
          3,
          0,
          4
        ]
      ],
      "name": "diamond_top_reflective",
      "vertex_count": 5,
      "face_count": 4,
      "triangle_count": 4
    },
    {
      "type": "TriangleMesh",
      "material": {
        "type": "TransparentMaterial",
        "ambient": [
          0.0,
          0.0,
          0.0
        ],
        "diffuse": [
          0.0,
          0.0,
          0.0
        ],
        "specular": [
          0.0,
          0.0,
          0.0
        ],
        "shininess": 1.0,
        "attenuation": [
          0.8999999761581421,
          0.949999988079071,
          0.9800000190734863
        ],
        "ior": 1.52
      },
      "shape_chain": [
        "TriangleMesh"
      ],
      "vertices": [
        [
          1.9000000953674316,
          1.0499999523162842,
          4.25
        ],
        [
          2.450000047683716,
          1.0499999523162842,
          4.800000190734863
        ],
        [
          3.0,
          1.0499999523162842,
          4.25
        ],
        [
          2.450000047683716,
          1.0499999523162842,
          3.700000047683716
        ],
        [
          2.450000047683716,
          0.09999994933605194,
          4.25
        ]
      ],
      "faces": [
        [
          1,
          0,
          4
        ],
        [
          2,
          1,
          4
        ],
        [
          3,
          2,
          4
        ],
        [
          0,
          3,
          4
        ]
      ],
      "name": "diamond_bottom_transparent",
      "vertex_count": 5,
      "face_count": 4,
      "triangle_count": 4
    },
    {
      "type": "Instance",
      "material": {
        "type": "TransparentMaterial",
        "ambient": [
          0.0,
          0.0,
          0.0
        ],
        "diffuse": [
          0.0,
          0.0,
          0.0
        ],
        "specular": [
          0.0,
          0.0,
          0.0
        ],
        "shininess": 1.0,
        "attenuation": [
          0.9300000071525574,
          0.9700000286102295,
          1.0
        ],
        "ior": 1.48
      },
      "shape": {
        "type": "Sphere",
        "material": {
          "type": "TransparentMaterial",
          "ambient": [
            0.0,
            0.0,
            0.0
          ],
          "diffuse": [
            0.0,
            0.0,
            0.0
          ],
          "specular": [
            0.0,
            0.0,
            0.0
          ],
          "shininess": 1.0,
          "attenuation": [
            0.9300000071525574,
            0.9700000286102295,
            1.0
          ],
          "ior": 1.48
        },
        "shape_chain": [
          "Sphere"
        ],
        "center": [
          4.25,
          1.0499999523162842,
          3.549999952316284
        ],
        "radius": 1.0
      },
      "shape_chain": [
        "Instance",
        "Sphere"
      ],
      "matrix": [
        [
          0.550000011920929,
          0.0,
          0.0,
          0.0
        ],
        [
          0.0,
          1.100000023841858,
          0.0,
          0.0
        ],
        [
          0.0,
          0.0,
          0.41999998688697815,
          0.0
        ],
        [
          0.0,
          0.0,
          0.0,
          1.0
        ]
      ]
    },
    {
      "type": "Sphere",
      "material": {
        "type": "EmissiveMaterial",
        "emission": [
          1.0,
          0.9800000190734863,
          0.949999988079071
        ],
        "shadow_passthrough": true
      },
      "shape_chain": [
        "Sphere"
      ],
      "center": [
        2.7750000953674316,
        5.480000019073486,
        1.399999976158142
      ],
      "radius": 0.09
    },
    {
      "type": "Sphere",
      "material": {
        "type": "EmissiveMaterial",
        "emission": [
          1.0,
          0.9800000190734863,
          0.949999988079071
        ],
        "shadow_passthrough": true
      },
      "shape_chain": [
        "Sphere"
      ],
      "center": [
        1.5499999523162842,
        5.480000019073486,
        3.950000047683716
      ],
      "radius": 0.09
    },
    {
      "type": "Sphere",
      "material": {
        "type": "EmissiveMaterial",
        "emission": [
          1.0,
          0.9800000190734863,
          0.949999988079071
        ],
        "shadow_passthrough": true
      },
      "shape_chain": [
        "Sphere"
      ],
      "center": [
        4.0,
        5.480000019073486,
        3.950000047683716
      ],
      "radius": 0.09
    }
  ],
  "lights": [
    {
      "type": "PointLight",
      "pos": [
        2.7750000953674316,
        5.480000019073486,
        1.399999976158142
      ],
      "power": [
        0.6499999761581421,
        0.6499999761581421,
        0.6200000047683716
      ]
    },
    {
      "type": "PointLight",
      "pos": [
        1.5499999523162842,
        5.480000019073486,
        3.950000047683716
      ],
      "power": [
        0.550000011920929,
        0.6200000047683716,
        0.7200000286102295
      ]
    },
    {
      "type": "PointLight",
      "pos": [
        4.0,
        5.480000019073486,
        3.950000047683716
      ],
      "power": [
        0.7200000286102295,
        0.6000000238418579,
        0.550000011920929
      ]
    },
    {
      "type": "AreaLight",
      "pos": [
        1.2000000476837158,
        1.9500000476837158,
        13.449999809265137
      ],
      "power": [
        85.0,
        85.0,
        85.0
      ],
      "p": [
        1.2000000476837158,
        1.9500000476837158,
        13.449999809265137
      ],
      "e_u": [
        3.0999999046325684,
        0.0,
        0.0
      ],
      "e_v": [
        0.0,
        2.3499999046325684,
        0.0
      ],
      "samples_u": 3,
      "samples_v": 3,
      "light_sampling_mode": "stratified"
    }
  ]
}

outputs/proj1_final_20260502_201946/properties.md

## Qualidade da Estimativa

- **Rays Model (estimado)**: 63.555s
- **Rays Model (real)**: 144.189s
- **Rays Model (erro abs)**: 80.634s
- **Rays Model (erro rel)**: 55.923%
- **Rays Model (fator real/estimado)**: 2.27x
- **Rays Model (acurácia)**: 44.08%
- **Intersection Model (estimado)**: 63.555s
- **Intersection Model (real)**: 144.189s
- **Intersection Model (erro abs)**: 80.634s
- **Intersection Model (erro rel)**: 55.923%
- **Intersection Model (fator real/estimado)**: 2.27x
- **Intersection Model (acurácia)**: 44.08%